{
  "amount": "28549",
  "confirmedBalance": "96217767",
  "currency": {
    "code": "TLTC",
    "currencyType": "crypto",
    "divisibility": 8,
    "name": "Testnet Litecoin"
  },
  "memo": "Test spend testnet Litecoin",
  "orderId": "",
  "timestamp": "2019-10-21T12:03:41+10:00",
  "txid": "040ff27a140beb0dc8958e7d42c989d51e9fc7c703119cafb8e702b3ce1535ae",
  "unconfirmedBalance": "0"
}
